Category,Platform/Topic,Key Findings,Opportunity Level,Action Items,Investment Required,Timeline,Priority
BASELINE DATA,Dianping (大众点评),"Arsenal: 189 reviews (¥305/€40), Panorama: 224 reviews (¥253/€33) - MOST POPULAR, Dubravka: 153 reviews (¥234/€30), Nautika: NOT LISTED",High,"Monitor reviews, Respond in Chinese, Create Nautika profile","€500-2000/month for mgmt",Ongoing,CRITICAL

PLATFORM PRESENCE,Xiaohongshu/RED (小红书),"300M+ users, 70%+ young women, Shapes global tourism trends, Paris restaurants promoted on XHS during Olympics 2024, 52% of Chinese use for travel planning, Photo-centric platform",VERY HIGH,"Create XHS accounts, Partner with KOLs for photo content, Encourage check-ins, Create Instagram-worthy dishes/corners","€2000-5000 for KOL campaigns, €500/month mgmt",3-6 months,CRITICAL
PLATFORM PRESENCE,Mafengwo (蚂蜂窝),"Major Chinese travel site, User-generated travel guides and tips, Popular for European destination research",Medium,"List restaurants on platform, Encourage user reviews, Create destination guides","€1000-2000 setup",2-3 months,HIGH
PLATFORM PRESENCE,Trip.com/Ctrip (携程),"Largest OTA in China, Owns Trip.com for international, Restaurant discovery feature for 20 global destinations, Reviews and ratings system",HIGH,"List all 4 restaurants, Optimize profiles with photos, Partner for package deals","€2000-3000 for listings + optimization",1-2 months,CRITICAL
PLATFORM PRESENCE,Weibo (微博),"500M+ users, Most popular for travel KOLs, Open platform for viral reach, Travel influencers prefer Weibo",HIGH,"Create official accounts, Share stunning photos/videos, Partner with travel KOLs, Run campaigns","€1500-3000/campaign + €500/month mgmt",2-4 months,HIGH
PLATFORM PRESENCE,Douyin (抖音),"China's TikTok, 400M+ daily users, Food exploration category very popular, Travel commerce: $40bn in 2024, Short video format",VERY HIGH,"Create short-form video content, Partner with food bloggers on Douyin, Showcase dining experience/views, Run video ads","€2000-4000 for video production + €1500/campaign",3-6 months,CRITICAL
PLATFORM PRESENCE,Zhihu (知乎),"Chinese Quora, Q&A platform, Croatia travel content exists, Used for detailed travel research",Medium,"Monitor questions about Dubrovnik, Provide expert answers, Build thought leadership","€500-1000 for content creation",3-6 months,MEDIUM
PLATFORM PRESENCE,Fliggy (飞猪),"Alibaba's travel platform, 1.5M+ hotels globally, Gen Z and affluent travelers, Integrated with Alipay/Taobao, Restaurant reservation features",HIGH,"List on platform, Create special packages, Integrate with Alibaba ecosystem","€1500-2500 setup + ongoing",2-4 months,HIGH
PLATFORM PRESENCE,WeChat (微信),"1.3B+ users, Essential for Chinese market, WeChat Pay integration, Mini Programs for reservations, WeChat Go Europe exists",VERY HIGH,"Create official account, Develop Mini Program, Enable WeChat Pay, Share articles/updates, Run targeted ads","€3000-5000 for Mini Program + €1000/month",1-3 months,CRITICAL

MARKET STATISTICS,Chinese Tourists to Croatia 2024,"150,000 Chinese visitors to Croatia (Jan-Oct 2024), 93% growth YoY, Largest increase in Europe alongside Belgium, Down from 500,000 pre-pandemic (2019)",HIGH,"Target recovery to pre-pandemic levels, Position for growth phase","N/A - Market intelligence",N/A,INFO
MARKET STATISTICS,Overall Croatia Tourism 2024,"21.3M total visitors (+4% YoY), Tourism revenue: €16B+ (record), Chinese represent ~0.7% of total visitors but high-value segment",Medium,"Focus on quality over quantity, Premium positioning for Chinese segment","N/A - Market intelligence",N/A,INFO
MARKET STATISTICS,Chinese Outbound Tourism 2025,"200M trips projected by 2028, 145M trips in 2024 (+17% spending), Full recovery expected by 2025, ¥5.75 trillion total spending in 2024",VERY HIGH,"Capture share of growing market, Position before full recovery","N/A - Market intelligence",N/A,INFO
MARKET STATISTICS,Spending Power,"Chinese tourists spend 60% more per night vs other markets, 28% budget over ¥50,000 (~$6,900) per trip, 72% planning multiple international trips, Premium/luxury segment growing fastest",VERY HIGH,"Create premium experiences, Develop luxury packages, Premium positioning for Nautika","€2000-3000 for package development",2-3 months,CRITICAL

INFLUENCER LANDSCAPE,Top Travel KOLs,"Molly 猫力: 6.6M Weibo followers, Nono 抬头看风景: 5.2M followers, Xiao Mo: 525K Weibo + strong photography, Mia Zhang: luxury travel + photography, Fan Yichen: combines travel with food",VERY HIGH,"Invite to Dubrovnik for fam trip, Offer complimentary dining experiences, Create collaborative content, Long-term partnerships","€5000-15000 per major KOL visit (flights, accommodation, dining, fees)",3-6 months,CRITICAL
INFLUENCER LANDSCAPE,Food Bloggers,"Li Ziqi: Global recognition for food content, Food tourism is major trend, Fan Yichen specializes in culinary adventures, Douyin food bloggers: recipes, atmosphere, pricing, taste",HIGH,"Target food-focused KOLs, Create behind-the-scenes content, Chef collaboration videos, Signature dish showcases","€3000-8000 per food blogger campaign",2-4 months,HIGH
INFLUENCER LANDSCAPE,Platform Preferences,"KOLs prioritize Douyin for short videos, Xiaohongshu for detailed itineraries, Weibo for broad reach, Multiple platforms strategy essential",HIGH,"Multi-platform KOL strategy, Repurpose content across platforms, Platform-specific content formats","€2000-4000 for multi-platform campaigns",Ongoing,HIGH
INFLUENCER LANDSCAPE,Collaboration Strategy,"Fam trips standard practice, Content rights negotiation important, Long-term relationships preferred, Authentic experiences valued",Medium,"Develop KOL collaboration framework, Create partnership packages, Build long-term relationships","€1000-2000 for framework development",1-2 months,MEDIUM

TOUR OPERATORS,Chinese Operators,"CITS (oldest/largest state-owned, 120+ branches, 1,400 global partners), Major agencies not promoting Croatia heavily yet, Infrastructure exists (32-year transport company)",MEDIUM,"Contact CITS and major operators, Create B2B packages, Offer commission structure, Develop group menus","€2000-3000 for B2B materials + travel to China for meetings",6-12 months,MEDIUM
TOUR OPERATORS,Group Dining,"Chinese groups prefer: banquet-style seating, Family-style sharing, Noisy/upbeat atmosphere OK, Set menus preferred, Clear pricing",HIGH,"Create group set menus (¥250-300pp), Private dining areas for groups, Chinese-friendly service style, Banquet options","€1000-2000 for menu development",2-3 months,HIGH
TOUR OPERATORS,Partnership Model,"Commission-based partnerships, Pre-booked guaranteed capacity, Long-term contracts preferred, Direct relationships with tour leaders",Medium,"Develop commission structure (10-15%), Create partnership agreements, Train staff on group service","€500-1000 for legal/contract work",3-4 months,MEDIUM

ADVERTISING,WeChat Advertising,"Official accounts allow content + ads, Mini Programs for reservations, WeChat Pay integration critical, Targeted ads to travelers, Articles/moments ads",VERY HIGH,"Launch WeChat official account, Run targeted ad campaigns, Create travel content series, Partner with travel accounts","€2000-5000/month for ads + content",1-2 months,CRITICAL
ADVERTISING,Xiaohongshu Campaigns,"KOL collaborations most effective, UGC (user-generated content) valued, Photo quality critical, Hashtag campaigns work well, Community engagement important",VERY HIGH,"Launch #DubrovnikDining campaign, Seed with KOL content, Encourage check-ins with incentives, Run photo contests","€3000-6000 for initial campaign + KOL fees",2-3 months,CRITICAL
ADVERTISING,Mafengwo Sponsored Content,"Destination guides, Restaurant features, Travel itineraries, User reviews important, Trust-based platform",Medium,"Create sponsored destination content, Restaurant feature articles, User review incentives","€1500-3000 for sponsored content",2-4 months,MEDIUM
ADVERTISING,Douyin/TikTok Ads,"Short-form video ads (15-60 sec), In-feed ads, Brand takeovers, Hashtag challenges, Live streaming potential",HIGH,"Create professional video content, Run in-feed ad campaigns, Consider live streaming events, Hashtag challenges",€3000-7000 for video + ads,2-4 months,HIGH
ADVERTISING,Ctrip/Trip.com Partnership,"Featured listings, Sponsored placements, Package deals promotion, Review management, Photo galleries",HIGH,"Upgrade to premium listings, Create exclusive Ctrip packages, Optimize with professional photos, Manage reviews actively","€2000-4000 for optimization + packages",1-2 months,HIGH
ADVERTISING,Fliggy Partnership,"Alibaba ecosystem integration, Alipay payment, Cross-promotion with hotels, Targeted to Gen Z + affluent, Livestream capabilities",HIGH,"Create Fliggy store, Develop packages with local hotels, Run livestream events, Alipay exclusive offers","€2500-5000 for setup + campaigns",2-4 months,HIGH
ADVERTISING,Chinese OTA Ecosystem,"Bundle restaurant + hotel packages, Partner with local Croatia hotels, Cross-promotion opportunities, Appear in curated lists",MEDIUM,"Develop partnerships with nearby hotels, Create combination packages, Join curated dining lists","€1500-3000 for partnership development",3-6 months,MEDIUM

PAYMENT INTEGRATION,WeChat Pay,"Essential for Chinese tourists, Europe expansion active, Used by 900M+ people, Trusted payment method, Silkpay can facilitate",VERY HIGH,"Integrate WeChat Pay, Train staff on usage, Display acceptance signage, Offer WeChat Pay exclusive deals","€500-1500 setup + 2-3% transaction fees",1 month,CRITICAL
PAYMENT INTEGRATION,Alipay,"Equally important as WeChat Pay, 1B+ users globally, European restaurant adoption growing, Partner integration available",VERY HIGH,"Integrate Alipay, Train staff on usage, Display acceptance signage, Alipay exclusive promotions","€500-1500 setup + 2-3% transaction fees",1 month,CRITICAL
PAYMENT INTEGRATION,Payment Preferences,"Mobile payment preferred over cards, QR code payment familiar, Cash less common, Contactless preferred, Security valued",HIGH,"Ensure both WeChat Pay + Alipay, Display QR codes clearly, Train staff on troubleshooting, Have Chinese payment guides","€200-500 for training + materials",1-2 months,HIGH

CULTURAL INSIGHTS,Dining Expectations,"Prefer noisy/upbeat vs. formal silence, Family-style sharing valued, Large portions appreciated, Care about atmosphere = food quality, Rice/noodles appreciated as options",HIGH,"Adjust service style for Chinese guests, Offer family-style platters, Consider Chinese staples option, Embrace livelier atmosphere for groups","€500-1000 for menu additions + training",2-3 months,HIGH
CULTURAL INSIGHTS,Photography Behavior,"82% consider photo-sharing essential (vs 43% global), Photo ops drive restaurant choice, Xiaohongshu influences food trends, Instagrammable = success, Share during meal (not after)",VERY HIGH,"Create photo-worthy presentation, Designate photo spots with good lighting, Scenic view tables priority, Consider aesthetic plate presentation, Train staff to help with photos","€1000-2000 for aesthetic upgrades",1-2 months,CRITICAL
CULTURAL INSIGHTS,Language Needs,"Chinese menu essential, Staff with basic Mandarin helpful, Translation apps common, Visual menus work well, QR code multilingual menus ideal",HIGH,"Create professional Chinese menus, Implement QR multilingual menu, Train staff in basic Mandarin phrases, Use visual menu boards, Partner with translation apps","€1000-2000 for menus + training",1-2 months,HIGH
CULTURAL INSIGHTS,Service Style,"Attentive service valued, Quick service preferred, Tea/hot water expected, Separate checks less common, Group leader usually pays",MEDIUM,"Train on Chinese service preferences, Offer hot water/tea, Understand group dynamics, Prepare for large single payments","€300-500 for training",1 month,MEDIUM
CULTURAL INSIGHTS,Food Preferences,"Seafood highly valued, Lighter cooking appreciated, Less spicy than locals, Portion size matters, Familiar options appreciated (rice, noodles)",MEDIUM,"Highlight seafood options, Offer rice with mains, Adjust spice levels, Clear allergen info, Consider Chinese-fusion options","€500-1000 for menu adjustments",1-2 months,MEDIUM
CULTURAL INSIGHTS,Social Sharing,"Post during dining experience, Tag locations important, Reviews post-trip, Platform: Xiaohongshu > Douyin > Weibo, Honest opinions valued",HIGH,"Encourage tagging on Chinese platforms, Create shareable moments, Monitor mentions across platforms, Respond to posts in Chinese","€500/month for social monitoring + response",Ongoing,HIGH

TECHNOLOGY,QR Code Menus,"Multi-language capability essential, Chinese language must-have, 23-100 languages possible, Google Translate integration, Browser auto-detect language",HIGH,"Implement multilingual QR menu, Ensure professional Chinese translation, Test user experience, Update regularly with photos","€800-1500 for setup + €200/month maintenance",1 month,HIGH
TECHNOLOGY,WeChat Mini Program,"Reservation capability, Menu browsing, Payment integration, Location services, Loyalty programs possible",HIGH,"Develop restaurant Mini Program, Integrate reservations, Enable mobile payment, Create digital loyalty program","€3000-6000 for development + €300/month hosting",2-4 months,HIGH
TECHNOLOGY,Translation Apps,"Google Translate common, Pleco for food terms, Real-time photo translation, Staff training on helping with apps",MEDIUM,"Staff training on translation app assistance, Photo menus for easy translation, Patience and support culture","€200-300 for training",1 month,MEDIUM
TECHNOLOGY,WiFi & Connectivity,"VPN access needed for Google/FB/IG, Reliable WiFi essential for WeChat/Alipay, Chinese tourists rely on mobile connectivity",HIGH,"Provide excellent WiFi, Consider VPN access info, Enable seamless mobile payment connectivity, QR code for WiFi","€300-500 for WiFi upgrades if needed",1 month,HIGH

COMPETITIVE POSITIONING,Arsenal Strategy,"Premium positioning (¥305/€40), 189 Dianping reviews, #2 popularity, Western fine dining perception",HIGH,"Emphasize luxury experience, Target high-spending Chinese, Enhance Dianping presence, Premium KOL partnerships","€2000-3000/month",Ongoing,HIGH
COMPETITIVE POSITIONING,Panorama Strategy,"Best value (¥253/€33), 224 reviews - MOST POPULAR, #1 popularity, Cable car experience adds value",VERY HIGH,"Maintain value leadership, Maximize Dianping reviews, Target mid-luxury segment, Emphasize view + cable car experience","€1500-2500/month",Ongoing,CRITICAL
COMPETITIVE POSITIONING,Dubravka Strategy,"Budget-friendly (¥234/€30), 153 reviews, #3 popularity, Cafe format, Casual dining",MEDIUM,"Target younger Chinese travelers, Budget-conscious segment, Social media focus, Casual dining experience","€1000-2000/month",Ongoing,MEDIUM
COMPETITIVE POSITIONING,Nautika Strategy,"NOT ON DIANPING - MAJOR GAP, Highest-end positioning, Potential premium Chinese segment, Conde Nast #6 romantic restaurant",CRITICAL,"CREATE DIANPING PROFILE URGENTLY, Position as ultra-premium, Target luxury Chinese travelers, Exclusive experiences, Ultra-high-net-worth focus","€3000-5000 for launch + €2000/month",IMMEDIATE,CRITICAL

STRATEGIC RECOMMENDATIONS,Immediate Actions (0-3 months),"1. Create Nautika Dianping profile, 2. Integrate WeChat Pay + Alipay, 3. Launch Chinese language menus, 4. Implement QR multilingual menus, 5. Create Xiaohongshu accounts",CRITICAL,"Allocate €10,000-15,000 immediate budget, Assign Chinese market manager, Partner with Chinese digital agency, Set up payment systems","€10,000-15,000",0-3 months,CRITICAL
STRATEGIC RECOMMENDATIONS,Short-term (3-6 months),"1. First KOL fam trip (2-3 influencers), 2. Launch WeChat Mini Programs, 3. Douyin video content creation, 4. Xiaohongshu campaign, 5. Staff Mandarin training basics",HIGH,"Budget €15,000-25,000, Hire KOL agency, Develop content strategy, Train staff, Measure results","€15,000-25,000",3-6 months,HIGH
STRATEGIC RECOMMENDATIONS,Medium-term (6-12 months),"1. Expand to all Chinese OTAs, 2. Tour operator partnerships (CITS + others), 3. Regular KOL program, 4. Group dining packages, 5. Full Chinese digital presence",HIGH,"Budget €20,000-30,000, Build B2B relationships, Scale KOL program, Optimize based on data","€20,000-30,000",6-12 months,MEDIUM
STRATEGIC RECOMMENDATIONS,Long-term (12+ months),"1. Chinese airline partnerships, 2. Sustained multi-platform presence, 3. Annual KOL events, 4. Chinese market manager dedicated role, 5. Loyalty program for Chinese guests",MEDIUM,"Budget €30,000-50,000/year, Full-time Chinese market specialist, Measure ROI, Continuous optimization","€30,000-50,000/year",12+ months,MEDIUM

INVESTMENT SUMMARY,Total Investment Year 1,"Immediate (0-3mo): €10-15K, Short-term (3-6mo): €15-25K, Medium-term (6-12mo): €20-30K, TOTAL YEAR 1: €45,000-70,000",HIGH,"Staged investment approach, Monitor ROI at each phase, Adjust based on results, Start small and scale","€45,000-70,000",Year 1,INFO
INVESTMENT SUMMARY,Expected ROI,"Chinese tourists spend 60% more than average, 28% budget €6,900+ per trip, Target 100-200 additional high-value Chinese guests, Potential revenue: €100,000-200,000 incremental",HIGH,"Track Chinese guest visits, Monitor average spend, Measure platform attribution, Calculate incremental revenue","Target: €100K-200K incremental revenue",Year 1,INFO
INVESTMENT SUMMARY,Break-even Analysis,"Investment: €45-70K Year 1, Target incremental Chinese guests: 150-200, Average spend target: €300-350pp, Break-even: ~200 guests at €300pp","Medium","Monthly tracking, Adjust marketing spend, Focus on high-ROI channels, Scale what works","200 Chinese guests = break-even",6-9 months,INFO

KEY SUCCESS FACTORS,Platform Diversification,"Don't rely on single platform, Xiaohongshu + Douyin + WeChat = essential trio, Dianping for reviews, Ctrip/Trip for bookings, Fliggy for packages",CRITICAL,"Multi-platform strategy, Consistent branding across platforms, Platform-specific content, Integrated approach","Included in platform budgets",Ongoing,CRITICAL
KEY SUCCESS FACTORS,Authentic Chinese Engagement,"Professional Chinese translation (not Google), Native Chinese community manager, Respond in Chinese, Understand cultural nuances, Genuine hospitality",CRITICAL,"Hire native Chinese speaker, Cultural sensitivity training, Authentic engagement, Long-term relationships","€30,000-40,000/year for Chinese manager",Ongoing,CRITICAL
KEY SUCCESS FACTORS,KOL Relationships,"Quality over quantity, Long-term partnerships, Authentic experiences, Fair compensation, Creative freedom",HIGH,"Selective KOL partnerships, Build relationships, Provide exceptional experiences, Track results","€15,000-30,000/year KOL budget",Ongoing,HIGH
KEY SUCCESS FACTORS,Payment Flexibility,"WeChat Pay + Alipay non-negotiable, Train staff thoroughly, Clear signage, Troubleshooting support, Exclusive payment offers",CRITICAL,"Implement both systems, Staff training, Maintenance support, Promotional campaigns","€1,000-3,000 setup + ongoing fees",Immediate,CRITICAL
KEY SUCCESS FACTORS,Data-Driven Optimization,"Track Chinese guest origin, Monitor platform performance, A/B test campaigns, ROI measurement, Continuous improvement",HIGH,"Analytics setup, Monthly reporting, Performance reviews, Adjust strategy based on data","€500-1,000/month for analytics tools",Ongoing,HIGH

RISK MITIGATION,Market Volatility,"Chinese outbound tourism sensitive to economic conditions, 71% of agents cite economic environment as factor, Consumer confidence matters, Geopolitical factors",MEDIUM,"Diversify marketing across segments, Don't over-invest initially, Flexible budgets, Monitor macro trends","N/A - Strategic planning",Ongoing,MEDIUM
RISK MITIGATION,Platform Changes,"Chinese platforms evolve rapidly, Algorithm changes common, Regulatory environment shifts, Platform popularity changes",MEDIUM,"Multi-platform approach, Stay informed on changes, Flexible content strategy, Build owned channels (Mini Program, official accounts)","€500/month for monitoring + adaptation",Ongoing,MEDIUM
RISK MITIGATION,Competition,"Other European destinations competing, Croatia destinations competing for same guests, Need differentiation, First-mover advantage matters",HIGH,"Unique positioning, Leverage Dubrovnik UNESCO status, Premium quality focus, Build relationships early","Included in marketing budget",Ongoing,HIGH
RISK MITIGATION,Translation Quality,"Poor translation damages credibility, Cultural misunderstandings possible, Tone matters in Chinese, Professional translation essential",HIGH,"Native speaker review always, Professional translation services, Cultural consultant, Regular updates and checks","€1,000-2,000/year for professional translation",Ongoing,HIGH

MARKET OPPORTUNITIES,Recovery Momentum,"Croatia saw 93% YoY growth in Chinese visitors, Still only 30% of 2019 levels, Huge recovery potential, First-mover advantage available, Pre-pandemic: 500K visitors possible again",VERY HIGH,"Capture early adopters, Build reputation now, Position for recovery wave, Establish presence before competitors","N/A - Market timing advantage",Immediate,CRITICAL
MARKET OPPORTUNITIES,Premium Segment,"Young high-spenders (post-90s/00s tech/finance), Affluent professionals seeking curated experiences, Silver travelers with large pensions, All three segments growing, Dubrovnik fits premium positioning",VERY HIGH,"Develop premium packages, Curated experiences, Exclusive offerings, VIP treatment, Premium marketing","€3,000-5,000 for premium package development",2-4 months,HIGH
MARKET OPPORTUNITIES,Croatia Destination Growth,"Schengen visa growth supporting, Chinese tourists drawn to cultural heritage, Game of Thrones effect, Adriatic appeal, Mediterranean cuisine attraction",HIGH,"Leverage Croatia tourism board initiatives, Partner with other Croatia businesses, Destination marketing participation, Cultural heritage storytelling","€1,000-2,000/year for partnerships",Ongoing,MEDIUM
MARKET OPPORTUNITIES,Food Tourism Trend,"Food tourism major trend in China, 54.7% of top KOL collaborations are food, Chinese tourists specifically interested in local gastronomy, Croatian Mediterranean cuisine appeal",VERY HIGH,"Position as culinary destination, Showcase Croatian ingredients, Chef stories and techniques, Food-focused KOL campaigns, Behind-the-scenes content","€2,000-4,000 for food content campaigns",2-4 months,HIGH
MARKET OPPORTUNITIES,Photo Tourism,"82% of Chinese travelers consider photos essential, Dubrovnik is photogenic, Scenic views major attraction, Social media sharing drives visits, Instagram/Xiaohongshu worthy locations",VERY HIGH,"Optimize photo opportunities, Create Instagrammable moments, Lighting and aesthetics, Designated photo spots, Encourage and facilitate sharing","€1,000-2,000 for aesthetic enhancements",1-2 months,HIGH

DESTINATION CONTEXT,Dubrovnik Assets,"UNESCO World Heritage Site, Game of Thrones filming location, Medieval architecture, Adriatic Sea views, Cable car to Srđ, Cultural heritage, Mediterranean cuisine",HIGH,"Leverage all assets in marketing, GoT tourism tie-ins, Heritage storytelling, View emphasis, Cable car partnership (Panorama), Cultural narrative","Included in content creation",Ongoing,HIGH
DESTINATION CONTEXT,Croatia Tourism Board,"Actively promoting Chinese market, Visa facilitation efforts, Partnership opportunities available, Destination marketing support, Industry collaboration",MEDIUM,"Engage with tourism board, Participate in initiatives, Co-marketing opportunities, Access resources and data, Industry networking","€500-1,000/year for memberships",3-6 months,MEDIUM
DESTINATION CONTEXT,Seasonal Opportunities,"Peak summer season (Jun-Sep), Shoulder seasons opportunity (Apr-May, Oct), Off-season challenges (Nov-Mar), Chinese New Year potential (Jan-Feb), Golden Week opportunity (Oct)",MEDIUM,"Develop seasonal packages, Chinese New Year special menus, Golden Week promotions, Shoulder season value offers, Year-round appeal marketing","€1,000-2,000 for seasonal campaigns",Ongoing,MEDIUM

COMPETITOR ANALYSIS,Chinese Restaurants in Dubrovnik,"Kunlun Chinese Restaurant exists, Offers authentic Chinese food, Two menus (Chinese + Croatian/English), Some Chinese visitors prefer familiar food, Competition for Chinese guests",MEDIUM,"Acknowledge Chinese food option exists, Emphasize unique Croatian experience, Mediterranean cuisine education, Cultural experience positioning, Differentiate clearly","N/A - Positioning strategy",Ongoing,MEDIUM
COMPETITOR ANALYSIS,Other Fine Dining,"Restaurant 360, Proto, Lokanda Peskarija, Other premium Dubrovnik restaurants, Competition for Chinese tourists, Need differentiation",MEDIUM,"Monitor competitor Chinese presence, Differentiate positioning, Leverage unique assets (view, location, heritage), Service excellence, First-mover advantage on platforms","€500/month for competitive monitoring",Ongoing,MEDIUM

MEASUREMENT METRICS,Platform Metrics,"Dianping reviews/month target, Xiaohongshu followers/engagement, Douyin video views, WeChat article reads, Trip.com bookings, Fliggy conversions, Weibo mentions/shares",HIGH,"Set baseline metrics, Monthly tracking, Platform-specific KPIs, Engagement rates, Conversion tracking, Attribution modeling","Included in agency fees or €500/month for analytics",Ongoing,HIGH
MEASUREMENT METRICS,Business Metrics,"Chinese guest count/month, Average spend per Chinese guest, % of Chinese guests vs total, Revenue from Chinese guests, Guest acquisition cost, Customer lifetime value, Return visit rate",CRITICAL,"POS system tracking, Guest nationality data collection, Revenue attribution, Cost tracking, ROI calculation per channel, Monthly reporting","€500 for setup + ongoing tracking",Immediate,CRITICAL
