Category,Platform/Topic,Key Findings,Opportunity Level,Action Items,Investment Required,Timeline,Priority
MEASUREMENT METRICS,Brand Metrics,"Brand awareness in China, Share of voice vs competitors, Sentiment analysis (positive/negative), Platform authority scores, Influencer reach, User-generated content volume",MEDIUM,"Social listening tools, Sentiment tracking, Brand mention monitoring, Competitive benchmarking, Quarterly brand studies","€500-1,000/month for tools + analysis",2-3 months,MEDIUM

AGENCY PARTNERS,Chinese Digital Marketing Agencies,"Dragon Social (tourism specialist), Jing Social (premium), Hot Pot Digital (F&B focus), Eternityx/HiCom Asia (multi-platform), Sekkei Digital Group (KOL specialists)",HIGH,"Interview 3-5 agencies, Request proposals and case studies, Check Croatia experience, Evaluate platform expertise, Start with project then retainer","€2,000-5,000/month retainer",1-2 months,HIGH
AGENCY PARTNERS,KOL Agencies,"ParkLu (travel KOL database), Rougelink (Douyin specialists), Guanxi Group (travel bloggers), FreshLane (food/travel), Independent KOL managers",HIGH,"Build KOL agency relationships, Access to top-tier influencers, Campaign management, Performance tracking, Long-term partnerships","Included in KOL campaign budgets",2-3 months,HIGH
AGENCY PARTNERS,Translation Services,"Professional Chinese translation, Cultural adaptation not just translation, Menu translation specialists, Platform content localization, Native speaker review",HIGH,"Find reliable translation partner, Menu translation priority, Platform content ongoing, Cultural consultant role, Quality assurance process","€1,000-2,000/year + per-project fees",Immediate,HIGH
AGENCY PARTNERS,Payment Integration,"Silkpay (WeChat Pay/Alipay for Europe), Europass (travel tech), Local payment processors, Technical support essential, Ongoing maintenance",CRITICAL,"Select payment partner, Technical integration, Staff training, Support agreement, Monitor transaction fees and reliability","Setup fees + 2-3% transaction fees",Immediate,CRITICAL

FINAL RECOMMENDATIONS,Priority 1: Foundation (Month 1-2),"Create Nautika Dianping profile, Integrate WeChat Pay + Alipay, Launch Chinese menus (digital + print), Set up Xiaohongshu accounts for all restaurants, Partner with Chinese digital agency",CRITICAL,"Immediate action required, Foundation for all other efforts, Quick wins possible, Essential infrastructure, Budget: €8,000-12,000","€8,000-12,000",Month 1-2,CRITICAL
FINAL RECOMMENDATIONS,Priority 2: Visibility (Month 2-4),"First KOL fam trip (1-2 mid-tier influencers), Launch WeChat official accounts, Create Douyin video content, Optimize Dianping profiles, Implement QR multilingual menus",HIGH,"Build visibility, Generate content, Test and learn, Platform optimization, Budget: €8,000-15,000","€8,000-15,000",Month 2-4,HIGH
FINAL RECOMMENDATIONS,Priority 3: Scale (Month 4-8),"Major KOL campaign (top-tier influencers), Expand to all OTA platforms, WeChat Mini Program launch, Tour operator outreach, Sustained content strategy",HIGH,"Scale what works, Expand reach, B2B development, Automation, Budget: €15,000-25,000","€15,000-25,000",Month 4-8,MEDIUM
FINAL RECOMMENDATIONS,Priority 4: Optimize (Month 8-12),"Measure and optimize all channels, Scale high-ROI platforms, Cut underperforming channels, Develop loyalty program, Plan Year 2 strategy",MEDIUM,"Data-driven decisions, ROI optimization, Long-term planning, Sustainable growth, Budget: €10,000-15,000","€10,000-15,000",Month 8-12,MEDIUM

CONCLUSION,Executive Summary,"Chinese market represents significant high-value opportunity for Dubrovnik restaurants. Market is recovering (93% YoY growth) but still 70% below pre-pandemic levels - first-mover advantage available. Chinese tourists spend 60% more than average, with 28% budgeting €6,900+ per trip. Multi-platform digital presence essential: Xiaohongshu (photo-focused), Douyin (video), WeChat (engagement), Dianping (reviews), Ctrip (bookings). KOL partnerships critical for credibility and reach. Payment integration (WeChat Pay + Alipay) non-negotiable. Cultural adaptation required: photography-friendly, Chinese menus, attentive service. Year 1 investment: €45K-70K with potential €100K-200K incremental revenue. Staged approach recommended: foundation → visibility → scale → optimize.",CRITICAL,"Significant opportunity with clear path forward, First-mover advantage in recovering market, Data-driven approach with measurable ROI, Multi-platform strategy essential, Cultural sensitivity critical for success","Year 1: €45K-70K investment, Target: €100K-200K revenue, Break-even: ~200 Chinese guests",Year 1,CRITICAL
