Phase,Week,Action Item,Platform/Area,Responsible Party,Budget,Success Metric,Notes,Priority
CULTURAL_TRAINING,Topic,Group payment dynamics,Staff Training,HR + Finance,€100,Understand group leader pays (one check),Don't assume split checks,MEDIUM
CULTURAL_TRAINING,Topic,Cultural sensitivity,Staff Training,HR + Agency,€500,Broader cultural awareness training,Respect and understanding,HIGH

RISK_MITIGATION,Risk,Budget overruns,Financial Control,Finance + Marketing Director,€0,Monthly budget tracking and alerts,Stop spending if hitting limits,HIGH
RISK_MITIGATION,Risk,Lower ROI than expected,Performance,Marketing Director + Agency,€0,Go/no-go decision points at Month 3 and Month 6,Cut losses if not working,CRITICAL
RISK_MITIGATION,Risk,Platform account issues,Technical,Agency + IT,€500 contingency,Backup contacts and technical support,Chinese platforms can be challenging to navigate,MEDIUM
RISK_MITIGATION,Risk,Translation errors,Quality Control,Translator + Cultural Consultant,€500 for reviews,Native speaker review of all content,Poor translation damages credibility,HIGH
RISK_MITIGATION,Risk,Negative reviews,Reputation,Agency + Operations,Included in retainer,Rapid response protocol in Chinese,Address issues within 24-48 hours,HIGH
RISK_MITIGATION,Risk,Payment system downtime,Technical,IT + Payment Partner,Included in support,Backup payment methods available,Always have cash option too,MEDIUM
RISK_MITIGATION,Risk,KOL underperformance,Influencer,Agency,€0,Performance clauses in contracts,Minimum impressions/engagement guaranteed,MEDIUM
RISK_MITIGATION,Risk,Market volatility (COVID etc),External,Marketing Director,€0,Flexible contracts with exit clauses,Don't lock in long-term if uncertain,MEDIUM
RISK_MITIGATION,Risk,Competition copies strategy,Competitive,Marketing Director + Agency,€0,Build relationships and differentiation quickly,First-mover advantage is temporary,LOW

CONTINGENCY,Scenario,If Month 3 results below expectations,Decision Point,Marketing Director + Finance,€0,"Reassess: Cut budget 50%, focus on top 2 channels only",Reduce risk exposure,CRITICAL
CONTINGENCY,Scenario,If Month 6 results below expectations,Decision Point,Marketing Director + Finance,€0,Pause or pivot: Different platforms or approach,Major reassessment needed,CRITICAL
CONTINGENCY,Scenario,If results exceed expectations,Decision Point,Marketing Director + Finance,Variable,Scale up: Increase budget 50-100% for high-ROI channels,Double down on winners,HIGH
CONTINGENCY,Scenario,If payment systems fail,Backup Plan,Operations + IT,€0,Manual process: Staff note WeChat ID and process later,Temporary workaround,MEDIUM
CONTINGENCY,Scenario,If agency underperforms,Backup Plan,Marketing Director,€0,Switch agencies: Have backup agency identified,Performance reviews at Month 3 and 6,MEDIUM
CONTINGENCY,Scenario,If KOL campaign disappoints,Backup Plan,Agency,€500-1000,Boost with paid ads to compensate reach,Amplification strategy,MEDIUM
CONTINGENCY,Scenario,If Chinese market recovery stalls,Strategic,Marketing Director,€0,Reduce Year 2 investment accordingly,Market-dependent strategy,MEDIUM

QUICK_WINS,Opportunity,Respond to all existing Dianping reviews,Immediate Action,Agency,€500,"566 total reviews across 3 restaurants, show we care",Build trust and engagement,HIGH
QUICK_WINS,Opportunity,Add Chinese welcome sign,Immediate Action,Operations,€50,"欢迎光临 (Welcome) at entrance, shows cultural respect",Simple but impactful,MEDIUM
QUICK_WINS,Opportunity,Create photo corner at Panorama,Immediate Action,Operations,€200,"Sunset view photo spot with good lighting, drives UGC",Leverage view asset,HIGH
QUICK_WINS,Opportunity,Encourage staff to learn one phrase,Immediate Action,HR,€0,"Everyone learns 欢迎 (welcome), creates positive impression",Cultural bridge,MEDIUM
QUICK_WINS,Opportunity,Create shareable menu item,Immediate Action,Chef + Marketing,€200,"Photogenic signature dish, designed for Instagram/XHS",Photo-worthy food,HIGH
QUICK_WINS,Opportunity,Partner with nearby hotels,Immediate Action,Sales Director,€0,Cross-promotion with hotels hosting Chinese guests,Quick distribution channel,MEDIUM
QUICK_WINS,Opportunity,Contact Croatian Tourism Board,Immediate Action,Marketing Director,€0,Join Chinese market initiatives and get support,Leverage existing efforts,MEDIUM
QUICK_WINS,Opportunity,Set up WeChat QR code for contact,Immediate Action,IT + Marketing,€50,Guests can add restaurant on WeChat easily,Build owned audience,MEDIUM

LONG_TERM,Goal,Become #1 Dubrovnik restaurant group for Chinese tourists,Strategic Objective,All Departments,Year 1-3 investment,Market leadership position,"Known as best choice, referenced by guides",CRITICAL
LONG_TERM,Goal,500+ Chinese guests per year sustained,Revenue Target,All Departments,Ongoing investment,Significant revenue contribution,"At €300 avg = €150K annual revenue from Chinese segment",HIGH
LONG_TERM,Goal,Chinese market manager dedicated role,Team Building,HR + Finance,€30-40K/year salary,Full-time Chinese market specialist hired,In-house expertise,HIGH
LONG_TERM,Goal,Annual KOL event in Dubrovnik,Marketing Program,Marketing + Operations,€15-25K/year,3-5 KOLs invited annually for major content creation,Sustained visibility,MEDIUM
LONG_TERM,Goal,Partnership with Air China or similar,Distribution,Sales Director + Agency,€0 (revenue share model),Direct airline partnership for promotion,Premium distribution channel,MEDIUM
LONG_TERM,Goal,Chinese language menu updates quarterly,Operations Excellence,Operations + Translator,€200/quarter,Always current with seasonal offerings,Operational standard,MEDIUM
LONG_TERM,Goal,Mandarin-speaking staff at each location,Team Building,HR,€25-35K/year per person,4 Chinese-speaking staff members (1 per restaurant),Service excellence,MEDIUM
LONG_TERM,Goal,WeChat loyalty program with 1000+ members,Customer Retention,Marketing + IT,€2-3K/year program cost,Active database for direct marketing,Owned audience asset,MEDIUM
LONG_TERM,Goal,Featured in Chinese travel guides,PR & Media,Agency,€2-5K/year for PR,Listed in major Chinese Dubrovnik/Croatia guides,Credibility and discovery,LOW
LONG_TERM,Goal,100+ 5-star Dianping reviews per restaurant,Reputation,All Departments,Ongoing excellence,Total 400+ across portfolio,Market dominance signal,HIGH
